{
  "schema_version": 2,
  "profile_id": "boundary-8-week-3-day",
  "plan_start_date": { "value": "2026-07-20", "source": "user_entered" },
  "goal": {
    "race_date": { "value": "2026-09-13", "source": "user_entered" },
    "race_distance": { "value": "half_marathon", "source": "user_entered" },
    "intent": { "value": "finish_comfortably", "source": "user_entered" }
  },
  "availability": {
    "running_days": {
      "value": ["monday", "wednesday", "saturday"],
      "source": "user_entered"
    },
    "preferred_long_run_day": { "value": "saturday", "source": "user_entered" },
    "preferred_quality_day": { "value": "wednesday", "source": "user_entered" }
  },
  "baseline": {
    "average_weekly_distance_km": { "value": 20, "source": "derived" },
    "longest_run_km": { "value": 9, "source": "measured" },
    "recent_performances": { "value": [], "source": "measured" }
  },
  "constraints": {
    "recent_training_interruption_days": { "value": 0, "source": "user_entered" },
    "unavailable_dates": { "value": [], "source": "user_entered" }
  }
}
