{
  "schema_version": 2,
  "profile_id": "boundary-24-week-6-day",
  "plan_start_date": { "value": "2026-07-20", "source": "user_entered" },
  "goal": {
    "race_date": { "value": "2027-01-03", "source": "user_entered" },
    "race_distance": { "value": "half_marathon", "source": "user_entered" },
    "intent": { "value": "performance", "source": "user_entered" },
    "target_time_seconds": { "value": 7200, "source": "user_entered" }
  },
  "availability": {
    "running_days": {
      "value": ["monday", "tuesday", "wednesday", "thursday", "friday", "saturday"],
      "source": "user_entered"
    },
    "preferred_long_run_day": { "value": "saturday", "source": "user_entered" },
    "preferred_quality_day": { "value": "tuesday", "source": "user_entered" },
    "optional_recovery_day": { "value": "sunday", "source": "user_entered" }
  },
  "baseline": {
    "average_weekly_distance_km": { "value": 40, "source": "derived" },
    "longest_run_km": { "value": 16, "source": "measured" },
    "recent_performances": {
      "value": [
        {
          "date": "2026-06-15",
          "distance": "ten_km",
          "duration_seconds": 3180,
          "kind": "time_trial",
          "effort": "maximal"
        }
      ],
      "source": "measured"
    }
  },
  "constraints": {
    "recent_training_interruption_days": { "value": 0, "source": "user_entered" },
    "unavailable_dates": { "value": [], "source": "user_entered" }
  }
}
